{
  "meta": {
    "title": "Oligonucleotide Regulatory Requirements Graph",
    "version": "0.4.2",
    "data_model": "0.3",
    "generated": "2026-10-30",
    "doi": "10.5281/zenodo.23818609",
    "url": "https://dahak-bit.github.io/oligo-reqgraph/",
    "repository": "https://github.com/dahak-bit/oligo-reqgraph",
    "doi_versions": {
      "0.4.0": "10.5281/zenodo.23818610"
    },
    "gates": [
      {
        "id": "discovery",
        "label": "Discovery",
        "index": 0
      },
      {
        "id": "nonclinical",
        "label": "Nonclinical",
        "index": 1
      },
      {
        "id": "cta",
        "label": "CTA / IND",
        "index": 2
      },
      {
        "id": "p1",
        "label": "Phase 1",
        "index": 3
      },
      {
        "id": "p2",
        "label": "Phase 2",
        "index": 4
      },
      {
        "id": "p3",
        "label": "Phase 3",
        "index": 5
      },
      {
        "id": "filing",
        "label": "Filing & approval",
        "index": 6
      },
      {
        "id": "post",
        "label": "Post-approval",
        "index": 7
      }
    ],
    "domains": [
      {
        "id": "quality",
        "label": "Quality & CMC"
      },
      {
        "id": "nonclin",
        "label": "Nonclinical safety"
      },
      {
        "id": "clinical",
        "label": "Clinical & pharmacology"
      },
      {
        "id": "paed",
        "label": "Paediatric"
      },
      {
        "id": "rare",
        "label": "Rare, expedited & individualised"
      },
      {
        "id": "auth",
        "label": "Trial & marketing authorisation"
      },
      {
        "id": "spine",
        "label": "Development gate"
      },
      {
        "id": "consideration",
        "label": "Oligonucleotide consideration"
      }
    ],
    "groups": [
      {
        "id": "g-ich-quality",
        "domain": "quality",
        "members": [
          "ich-q1ar2",
          "ich-q1",
          "ich-q2r2",
          "ich-q3a",
          "ich-q3c",
          "ich-q3d",
          "ich-q11",
          "ich-q14",
          "ich-m7r2"
        ]
      },
      {
        "id": "g-oligo-quality",
        "domain": "quality",
        "members": [
          "ema-oligo-quality",
          "jp-oligo-quality",
          "pheur-oligo",
          "usp-oligo"
        ]
      },
      {
        "id": "g-carrier-quality",
        "domain": "quality",
        "members": [
          "ema-mab-gl",
          "fda-nanomaterials",
          "fda-liposome",
          "ema-ddc-gl"
        ]
      },
      {
        "id": "g-eu-expedited",
        "domain": "rare",
        "members": [
          "eu-accelerated",
          "eu-camp"
        ]
      },
      {
        "id": "g-safety-pharm",
        "domain": "nonclin",
        "members": [
          "ich-s7a",
          "ich-s7b"
        ]
      },
      {
        "id": "g-genotox-biotech",
        "domain": "nonclin",
        "members": [
          "ich-s2r1",
          "ich-s6r1"
        ]
      },
      {
        "id": "g-oligo-nonclin",
        "domain": "nonclin",
        "members": [
          "fda-oligo-nonclin",
          "pmda-oligo"
        ]
      },
      {
        "id": "g-m3-s5",
        "domain": "nonclin",
        "members": [
          "ich-m3r2",
          "ich-s5r3"
        ]
      },
      {
        "id": "g-cns-it",
        "domain": "nonclin",
        "members": [
          "cns-berman-booty-2023",
          "cns-toxpath-nfd"
        ]
      },
      {
        "id": "g-stats",
        "domain": "clinical",
        "members": [
          "ich-e9",
          "ich-e9r1",
          "ich-m10"
        ]
      },
      {
        "id": "g-gcp",
        "domain": "clinical",
        "members": [
          "ich-e6r3",
          "ich-e6r2"
        ]
      },
      {
        "id": "g-organ-impairment",
        "domain": "clinical",
        "members": [
          "fda-dili-2009",
          "fda-renal-pk-2024"
        ]
      },
      {
        "id": "g-e11",
        "domain": "paed",
        "members": [
          "ich-e11r1",
          "ich-e11a"
        ]
      },
      {
        "id": "g-ipsp",
        "domain": "paed",
        "members": [
          "fda-ipsp",
          "fda-fdara-pedonc"
        ]
      },
      {
        "id": "g-iaso",
        "domain": "rare",
        "members": [
          "fda-aso-admin",
          "fda-aso-ind-clin"
        ]
      },
      {
        "id": "g-cta",
        "domain": "auth",
        "members": [
          "eu-ctr",
          "us-ind",
          "uk-mhra-cta"
        ]
      }
    ],
    "triggers": {
      "paed_onc": "Paediatric oncology",
      "aoc": "Antibody–oligo conjugate",
      "lnp": "LNP-formulated",
      "galnac": "GalNAc–siRNA (hepatic)",
      "intrathecal": "Intrathecal / CNS",
      "individualised": "Individualised ASO"
    },
    "changes": "0.2.0: reconciled against a verified source inventory (107 documents); corrected status/dates/document numbers; added verification provenance and 19 documents.",
    "license_data": "CC BY 4.0",
    "license_code": "MIT",
    "disclaimer": "Reference map, not regulatory advice. Verify every document against the issuing body before relying on it.",
    "node_count": 104,
    "edge_count": 94
  },
  "nodes": [
    {
      "id": "m-discovery",
      "label": "Discovery & lead optimisation",
      "kind": "milestone",
      "region": "INTL",
      "ref": null,
      "date": null,
      "status": "in_force",
      "url": null,
      "scope": "Sequence/chemistry selection, in vitro screening, candidate nomination.",
      "oligo_note": "Hybridisation-based target ID; chemistry (PS, 2'-MOE, cEt, GalNAc) set here.",
      "confidence": "high",
      "modality": [
        "all_oligo"
      ],
      "domain": "spine",
      "gate_from": 0,
      "gate_to": 0,
      "key": "Discovery",
      "group": null,
      "triggers": [],
      "last_checked": null,
      "short": "Discovery"
    },
    {
      "id": "m-nonclinical",
      "label": "IND/CTA-enabling nonclinical package",
      "kind": "milestone",
      "region": "INTL",
      "ref": null,
      "date": null,
      "status": "in_force",
      "url": null,
      "scope": "Pivotal tox, safety pharmacology, genotox, TK before first-in-human.",
      "oligo_note": "",
      "confidence": "high",
      "modality": [
        "all_oligo"
      ],
      "domain": "spine",
      "gate_from": 1,
      "gate_to": 1,
      "key": "Nonclinical package",
      "group": null,
      "triggers": [],
      "last_checked": null,
      "short": "Nonclinical package"
    },
    {
      "id": "m-cta-ind",
      "label": "CTA / IND submission",
      "kind": "milestone",
      "region": "INTL",
      "ref": null,
      "date": null,
      "status": "in_force",
      "url": null,
      "scope": "Authorisation to begin human trials.",
      "oligo_note": "",
      "confidence": "high",
      "modality": [
        "all_oligo"
      ],
      "domain": "spine",
      "gate_from": 2,
      "gate_to": 2,
      "key": "CTA / IND",
      "group": null,
      "triggers": [],
      "last_checked": null,
      "short": "CTA / IND"
    },
    {
      "id": "m-phase1",
      "label": "First-in-human / Phase 1",
      "kind": "milestone",
      "region": "INTL",
      "ref": null,
      "date": null,
      "status": "in_force",
      "url": null,
      "scope": "Safety, tolerability, PK in humans.",
      "oligo_note": "",
      "confidence": "high",
      "modality": [
        "all_oligo"
      ],
      "domain": "spine",
      "gate_from": 3,
      "gate_to": 3,
      "key": "Phase 1 (FIH)",
      "group": null,
      "triggers": [],
      "last_checked": null,
      "short": "Phase 1 (FIH)"
    },
    {
      "id": "m-phase2",
      "label": "Phase 2",
      "kind": "milestone",
      "region": "INTL",
      "ref": null,
      "date": null,
      "status": "in_force",
      "url": null,
      "scope": "Dose-finding, proof of concept.",
      "oligo_note": "",
      "confidence": "high",
      "modality": [
        "all_oligo"
      ],
      "domain": "spine",
      "gate_from": 4,
      "gate_to": 4,
      "key": "Phase 2",
      "group": null,
      "triggers": [],
      "last_checked": null,
      "short": "Phase 2"
    },
    {
      "id": "m-eop2",
      "label": "End-of-Phase-2 interaction",
      "kind": "milestone",
      "region": "INTL",
      "ref": null,
      "date": null,
      "status": "in_force",
      "url": null,
      "scope": "Pivotal-design alignment; paediatric plan triggers cluster here.",
      "oligo_note": "",
      "confidence": "high",
      "modality": [
        "all_oligo"
      ],
      "domain": "spine",
      "gate_from": 4,
      "gate_to": 4,
      "key": "End-of-Phase-2",
      "group": null,
      "triggers": [],
      "last_checked": null,
      "short": "End-of-Phase-2"
    },
    {
      "id": "m-phase3",
      "label": "Phase 3 / pivotal",
      "kind": "milestone",
      "region": "INTL",
      "ref": null,
      "date": null,
      "status": "in_force",
      "url": null,
      "scope": "Confirmatory efficacy & safety.",
      "oligo_note": "",
      "confidence": "high",
      "modality": [
        "all_oligo"
      ],
      "domain": "spine",
      "gate_from": 5,
      "gate_to": 5,
      "key": "Phase 3",
      "group": null,
      "triggers": [],
      "last_checked": null,
      "short": "Phase 3"
    },
    {
      "id": "m-filing",
      "label": "MAA / NDA / BLA submission",
      "kind": "milestone",
      "region": "INTL",
      "ref": null,
      "date": null,
      "status": "in_force",
      "url": null,
      "scope": "Marketing application dossier (CTD).",
      "oligo_note": "",
      "confidence": "high",
      "modality": [
        "all_oligo"
      ],
      "domain": "spine",
      "gate_from": 6,
      "gate_to": 6,
      "key": "MAA / NDA / BLA",
      "group": null,
      "triggers": [],
      "last_checked": null,
      "short": "MAA / NDA / BLA"
    },